{"schema":"code-intel-compatibility-retirement-evidence.v1","snapshotIdentity":"9b9e068a689bc5674ee759124d69800fd867d496e3a4109d0929dab0245d373e","id":"e03.golden-parity","evidenceClass":"golden_parity","retirementId":"retire-provider-preflight-branch","legacyBranchId":"run-code-intel.provider-preflight.test-wrapper","replacementCapabilityId":"provider.repowise-adapt","details":{"outcome":"passed","assertionCount":3,"command":"scripts/tests/test-repowise-adapter-contract.ps1"}}