{"schema":"code-intel-compatibility-retirement-evidence.v1","snapshotIdentity":"9b9e068a689bc5674ee759124d69800fd867d496e3a4109d0929dab0245d373e","id":"e03.dependency-repo-snapshot","evidenceClass":"dependency_approval","retirementId":"retire-provider-preflight-branch","legacyBranchId":"run-code-intel.provider-preflight.test-wrapper","replacementCapabilityId":"provider.repowise-adapt","details":{"outcome":"passed","dependencyId":"repo.snapshot","status":"approved","reviewer":"e03-author"}}