{"schema":"code-intel-compatibility-retirement-evidence.v1","snapshotIdentity":"ff712225ab6fea6d458a660b15350f3fcc75b8158c24ed7d995f6a786171365a","id":"e09.dependency-snapshot","evidenceClass":"dependency_approval","retirementId":"retire-doctor-wrapper-branch","legacyBranchId":"invoke-code-intel.doctor.direct-production","replacementCapabilityId":"doctor","details":{"outcome":"passed","dependencyId":"repo.snapshot","status":"approved","reviewer":"e09-author"}}