{"schema":"code-intel-compatibility-retirement-evidence.v1","snapshotIdentity":"9b9e068a689bc5674ee759124d69800fd867d496e3a4109d0929dab0245d373e","id":"e03.registry-reconciliation","evidenceClass":"registry_reconciliation","retirementId":"retire-provider-preflight-branch","legacyBranchId":"run-code-intel.provider-preflight.test-wrapper","replacementCapabilityId":"provider.repowise-adapt","details":{"outcome":"passed","registryParticipantId":"facade.provider-preflight.test-wrapper","replacementCapabilityId":"provider.repowise-adapt","status":"deleted","historicalSourceRevision":"ca9334aa8eb8df3be7e10c5547069f03645cabe2","installerDiagnosticOutOfScope":true}}