{"schema":"code-intel-compatibility-retirement-evidence.v1","snapshotIdentity":"9af484f1df63b236c0fd7d17444db496d5818d3df7239484bf57d0de6b09160f","id":"e05.rollback-execution","evidenceClass":"rollback_execution","retirementId":"retire-publication-branch","legacyBranchId":"run-code-intel.publication.legacy-staging-marker","replacementCapabilityId":"run.commit","details":{"outcome":"passed","command":"pwsh -NoLogo -NoProfile -File tools/compatibility/Restore-PublicationLegacyBranch.ps1 -RehearsalRoot <packet-root>/rollback-rehearsal","executedAt":1785441780,"exitCode":0,"target":"rollback-rehearsal/run-code-intel.ps1","exactReplay":true,"sourceSha256":"adb25f8193f65b12ac35fc60a8d576deb752e28fb3960aecc774884f11ee0736","targetSha256":"adb25f8193f65b12ac35fc60a8d576deb752e28fb3960aecc774884f11ee0736","replacementChanged":false,"indexTraversalChanged":false}}