{"schema":"code-intel-compatibility-retirement-evidence.v1","snapshotIdentity":"8a59ac498c518bff9ef60dcf09be003a33050074735e524bf67e1fd75938d880","id":"e08.independent-approval","evidenceClass":"independent_approval","retirementId":"retire-hospital-branch","legacyBranchId":"run-code-intel.hospital.embedded-diagnosis-render","replacementCapabilityId":"diagnosis.hospital","details":{"outcome":"blocked","approved":false,"authorIndependent":false,"subjectSha256":"0000000000000000000000000000000000000000000000000000000000000000","reviewer":"independent-verifier-required","authorityEvent":{},"blocker":"no independent approval"}}