{"schema":"code-intel-compatibility-retirement-evidence.v1","snapshotIdentity":"2314ccd84ecf78c128fabfa58cc156e228f8de4e191172e5cbb980ce710801ea","id":"e05.independent-approval","evidenceClass":"independent_approval","retirementId":"retire-publication-branch","legacyBranchId":"run-code-intel.publication.legacy-staging-marker","replacementCapabilityId":"run.commit","details":{"outcome":"blocked","approved":false,"authorIndependent":false,"subjectSha256":"0000000000000000000000000000000000000000000000000000000000000000","reviewer":"independent-verifier-required","authorityEvent":{},"blocker":"no independent approval"}}