{"schema":"code-intel-compatibility-retirement-evidence.v1","snapshotIdentity":"c35859431d13bd71c231dc47a7a909f737820b3ea55f735450005be7386d9be4","id":"e10.golden-parity","evidenceClass":"golden_parity","retirementId":"retire-index-branch","legacyBranchId":"update-code-intel-index.legacy-compatibility-traversal","replacementCapabilityId":"artifact.index-committed-only","details":{"outcome":"passed","assertionCount":6,"executedRustTests":5,"executedPowerShellTests":1,"validOnlyAdmission":true,"stagingRejected":true,"markerlessRejected":true,"forgedRejected":true}}