{"schema":"code-intel-compatibility-retirement-evidence.v1","snapshotIdentity":"d8c543ac49a7d844f9ca03b9a9c75078da6842ec43499d8ba0d88eb176b17789","id":"e07.compatibility-window","evidenceClass":"compatibility_window","retirementId":"retire-native-code-branch","legacyBranchId":"run-code-intel.native-code.embedded","replacementCapabilityId":"evidence.native-code","details":{"outcome":"blocked","startedAt":1787803728,"observedThrough":1787803728,"minimumDays":30,"checkedAt":1787803728,"expiresAt":1790395728,"blocker":"no completed normal/full A09 production observation window"}}