{"schema":"code-intel-compatibility-retirement-evidence.v1","snapshotIdentity":"f15b093bdface49d6df0135732fe586aac2d8dfc027860493ae45d582d4372e6","id":"e10.c00-necessity","evidenceClass":"c00_necessity","retirementId":"retire-index-branch","legacyBranchId":"update-code-intel-index.legacy-compatibility-traversal","replacementCapabilityId":"artifact.index-committed-only","details":{"outcome":"passed","decision":"admit","changeId":"retire-index-branch","necessityTraceSha256":"676bdaf1d85c171a7a37c53e637b9e98823be72755dc613841e85f187f6c6011"}}