{"schema":"code-intel-compatibility-retirement-evidence.v1","snapshotIdentity":"9b9e068a689bc5674ee759124d69800fd867d496e3a4109d0929dab0245d373e","id":"e03.rollback-execution","evidenceClass":"rollback_execution","retirementId":"retire-provider-preflight-branch","legacyBranchId":"run-code-intel.provider-preflight.test-wrapper","replacementCapabilityId":"provider.repowise-adapt","details":{"outcome":"passed","command":"pwsh -NoLogo -NoProfile -File tools/compatibility/Restore-ProviderPreflightLegacyBranch.ps1 -RehearsalRoot work/e03-provider-preflight-rollback-1787803704","executedAt":1787803704,"exitCode":0,"target":"work/e03-provider-preflight-rollback-1787803704/run-code-intel.ps1","replacementChanged":false,"liveFacadeChanged":false}}