{"schema":"code-intel-compatibility-retirement-evidence.v1","snapshotIdentity":"20ace72401300cc58f054f7d76273d91005ce8fc3c71abeb71065b09bd1118f1","id":"e10.replacement-atom","evidenceClass":"replacement_atom","retirementId":"retire-index-branch","legacyBranchId":"update-code-intel-index.legacy-compatibility-traversal","replacementCapabilityId":"artifact.index-committed-only","details":{"outcome":"passed","status":"production_ready","capability":"artifact.index-committed-only","publicNormalUsesA08":true,"normalSchema":"code-intel-artifact-index.v1"}}