{"schema":"code-intel-compatibility-retirement-evidence.v1","snapshotIdentity":"ca08baf64380b8d243c0cc3a132b6573000a2f2b0dcefd9002707b09acbc69d7","id":"e04.replacement-atom","evidenceClass":"replacement_atom","retirementId":"retire-codenexus-direct-branch","legacyBranchId":"run-code-intel.codenexus-lite.direct","replacementCapabilityId":"provider.codenexus-adapt","details":{"outcome":"blocked","status":"pending_facade_route","capability":"provider.codenexus-adapt","b04FacadeAvailable":true,"b05FacadeAvailable":true,"liveDirectBranchCount":1,"blocker":"explicit Invoke-CodeNexusLite.ps1 compatibility fallback remains live; retirement requires an approved B04/B05 facade route"}}