{"schema":"code-intel-compatibility-retirement-evidence.v1","snapshotIdentity":"8a59ac498c518bff9ef60dcf09be003a33050074735e524bf67e1fd75938d880","id":"e08.replacement-atom","evidenceClass":"replacement_atom","retirementId":"retire-hospital-branch","legacyBranchId":"run-code-intel.hospital.embedded-diagnosis-render","replacementCapabilityId":"diagnosis.hospital","details":{"outcome":"blocked","status":"pending_facade_route","capability":"diagnosis.hospital","b09RegistryAvailable":true,"normalFacadeUsesB09":false,"blocker":"normal facade still executes embedded Hospital authority"}}