{"schema":"code-intel-compatibility-retirement-evidence.v1","snapshotIdentity":"12ee02ae917ee80d351c4bd92d54cc9f5561630f694c2464b9d96f393f5d143d","id":"e02.usage-observation","evidenceClass":"usage_observation","retirementId":"retire-recommender-branch","legacyBranchId":"run-code-intel.workflow-recommender.inline","replacementCapabilityId":"advisory.workflow-recommend","details":{"outcome":"blocked","startedAt":1787803694,"endedAt":1787803694,"totalInvocations":0,"legacyInvocations":0,"replacementInvocations":0,"blocker":"no production usage observation exists"}}