{"schema":"code-intel-compatibility-retirement-evidence.v1","snapshotIdentity":"d8c543ac49a7d844f9ca03b9a9c75078da6842ec43499d8ba0d88eb176b17789","id":"e07.registry-reconciliation","evidenceClass":"registry_reconciliation","retirementId":"retire-native-code-branch","legacyBranchId":"run-code-intel.native-code.embedded","replacementCapabilityId":"evidence.native-code","details":{"outcome":"passed","registryParticipantId":"evidence.native-code","replacementCapabilityId":"evidence.native-code","status":"declared","registryAuditOk":true,"toolchainDigest":"d07d257df1c36e879bba2f6bdc3f18f4c26a34ee05889fc19f4ab96bc2027051","embeddedFunctionSegmentCount":1,"embeddedCallSegmentCount":1,"deletionStatus":"not_authorized"}}