{"schema":"code-intel-compatibility-retirement-evidence.v1","snapshotIdentity":"ff712225ab6fea6d458a660b15350f3fcc75b8158c24ed7d995f6a786171365a","id":"e09.replacement-atom","evidenceClass":"replacement_atom","retirementId":"retire-doctor-wrapper-branch","legacyBranchId":"invoke-code-intel.doctor.direct-production","replacementCapabilityId":"doctor","details":{"outcome":"blocked","status":"pending_public_preflight_route_and_bootstrap_expiry","capability":"doctor","b10EnvelopeAvailable":true,"publicWrapperUsesDirectDoctor":true,"retainedBootstrap":"check-code-intel-tools.ps1","bootstrapNonAuthoritative":true,"bootstrapRegistered":true,"bootstrapOwner":"code-intel-pipeline","bootstrapExpiryDeclared":false,"blocker":"public preflight still invokes the bootstrap directly and retained bootstrap has no explicit expiry"}}