{"schema":"code-intel-compatibility-retirement-evidence.v1","snapshotIdentity":"3c23ca647931ae112b7876622a9aab2786d06c67889c7ea2b42e75e90c3f8dd4","id":"e04.rollback-execution","evidenceClass":"rollback_execution","retirementId":"retire-codenexus-direct-branch","legacyBranchId":"run-code-intel.codenexus-lite.direct","replacementCapabilityId":"provider.codenexus-adapt","details":{"outcome":"passed","command":"pwsh -NoProfile -File tools/compatibility/Restore-CodeNexusDirectBranch.ps1 -RehearsalRoot <packet-root>/rollback-rehearsal","executedAt":1788500000,"exitCode":0,"target":"rollback-rehearsal/run-code-intel.ps1","exactReplay":true,"unrelatedBranchesChanged":false}}