{"schema":"code-intel-compatibility-retirement-evidence.v1","snapshotIdentity":"1c095a2c79c7f3f4e30fe1d653abb9431c1e42f50c64b16f053a34133047c3a4","id":"e05.registry-reconciliation","evidenceClass":"registry_reconciliation","retirementId":"retire-publication-branch","legacyBranchId":"run-code-intel.publication.legacy-staging-marker","replacementCapabilityId":"run.commit","details":{"outcome":"passed","registryParticipantId":"facade.publication.legacy-staging-marker","replacementCapabilityId":"run.commit","status":"declared","indexTraversalExcluded":true}}