{"schema":"code-intel-compatibility-retirement-evidence.v1","snapshotIdentity":"1c095a2c79c7f3f4e30fe1d653abb9431c1e42f50c64b16f053a34133047c3a4","id":"e05.usage-observation","evidenceClass":"usage_observation","retirementId":"retire-publication-branch","legacyBranchId":"run-code-intel.publication.legacy-staging-marker","replacementCapabilityId":"run.commit","details":{"outcome":"blocked","startedAt":1785401485,"endedAt":1785401485,"totalInvocations":0,"legacyInvocations":0,"replacementInvocations":0,"blocker":"no production usage observation"}}