{"schema":"code-intel-compatibility-retirement-evidence.v1","snapshotIdentity":"8a59ac498c518bff9ef60dcf09be003a33050074735e524bf67e1fd75938d880","id":"e08.contract-parity","evidenceClass":"contract_parity","retirementId":"retire-hospital-branch","legacyBranchId":"run-code-intel.hospital.embedded-diagnosis-render","replacementCapabilityId":"diagnosis.hospital","details":{"outcome":"passed","assertionCount":7,"precedenceFailClosed":true,"a09SeededA01Route":true,"authoritativeEvidenceCannotBeOverridden":true}}